passage_id,ticker,company,sector,year,doc_type,section,text,word_count,quality,sentiment_label,sentiment_intensity,has_guidance,guidance_type,guidance_span,annotator,annotation_notes,annotation_status
NESTLE_2024_ceo_review_26_0,NESTLE,Nestle Nigeria Plc,Consumer Goods,2024,earnings_release,ceo_review,"The Company caters for the recreational needs of its employees by providing them with a wellness center and other games facilities such as Table Tennis, Draughts, etc. Lunch is provided free to staff in the Company's canteen.

The Company has a general licence agreement with Societe des Produits Nestlé S.A., Switzerland. Under the agreement, technological, scientific and professional assistance are provided for the manufacture, marketing, quality control and packaging of the Company's products, development of new products and training of personnel abroad.",82,poor,,,,,,,,pending
NESTLE_2024_ceo_review_28_0,NESTLE,Nestle Nigeria Plc,Consumer Goods,2024,earnings_release,ceo_review,"The Company obtained the approval of the National Office for Technology Acquisition and Promotion (NOTAP) with certificate No. CR 007459 for the remittance of General Licence Fees to Societe des Produits Nestlé S.A.,

Switzerland. The approval was for a period of three (3) years with effect from 1st January 2021 to 31st December",53,poor,,,,,,,,pending
NESTLE_2024_ceo_review_35_0,NESTLE,Nestle Nigeria Plc,Consumer Goods,2024,earnings_release,ceo_review,"The Nomination, Governance and Remuneration Committee is made up of three (3) directors appointed to make recommendations on the structure and composition of the Board and its Committees; governance issues and to submit proposals on the salaries of executive directors to the Board for approval. The members of the Committee are

In accordance with section 404 of the Companies and Allied Matters Act of Nigeria 2020, members that served on the audit committee during the period comprise:",77,poor,,,,,,,,pending
NESTLE_2024_ceo_review_41_0,NESTLE,Nestle Nigeria Plc,Consumer Goods,2024,earnings_release,ceo_review,"Nestlé Nigeria Plc to reduce unemployment, while others pursued personal objectives or were employed by other companies. Also, to empower the trainees with relevant skills, the top five (5) students in the scheme per batch were usually taken to Switzerland for further training within the Group's factories.

Disclosures a) Risk Management and Compliance System b) Sustainability Initiatives c) Related Party Transactions",61,poor,,,,,,,,pending
NESTLE_2024_ceo_review_44_0,NESTLE,Nestle Nigeria Plc,Consumer Goods,2024,earnings_release,ceo_review,"The Committee is to assist the Board in its oversight of audit, risk profile, risk management framework and the risk reward strategy. The Committee is to carry out periodic review of changes in the economic and business environment, including emerging trends and other factors relevant to the Company's risk profile. The members of the Committee are

Nestlé is a principle-based company, the Nestlé Corporate Business Principles (NCBP) form the foundation of all we do. NCBP consists of ten principles these are:",81,good,,,,,,,,pending
NESTLE_2024_ceo_review_46_0,NESTLE,Nestle Nigeria Plc,Consumer Goods,2024,earnings_release,ceo_review,"We encourage Health and Wellness of our employees via Work-Life Balance, provision of gym and other recreational facilities on our premises, provision of baby room, extended maternity leave that is not annual leave consuming and paternity leave.

Everywhere in the world, the Nestlé name guarantees to the consumer that the product is safe and of high standard.",57,poor,,,,,,,,pending
NESTLE_2024_ceo_review_50_0,NESTLE,Nestle Nigeria Plc,Consumer Goods,2024,earnings_release,ceo_review,"There is an effective internal control and audit function within the Company which gives reasonable assurance against any material misstatement or loss. The responsibilities include oversight functions of internal audit and control risk assessment and compliance, continuity and contingency planning, and formalisation and improvement of the

The directors are responsible for the total process of risk management as well as expressing their opinion on the effectiveness of the process. The risk management framework is integrated into the day-to-day operations of the business and provides guidelines and standards for administering the acceptance and on-going management of key risks such as operational, reputational, financial, market, technology and compliance risk. The directors are of the view that effective internal audit function exists in the Company and that risk management control and compliance systems are operating efficiently and effectively in all respects.",138,good,,,,,,,,pending
NESTLE_2024_ceo_review_51_0,NESTLE,Nestle Nigeria Plc,Consumer Goods,2024,earnings_release,ceo_review,"The directors are responsible for the total process of risk management as well as expressing their opinion on the effectiveness of the process. The risk management framework is integrated into the day-to-day operations of the business and provides guidelines and standards for administering the acceptance and on-going management of key risks such as operational, reputational, financial, market, technology and compliance risk. The directors are of the view that effective internal audit function exists in the Company and that risk management control and compliance systems are operating efficiently and effectively in all respects.",92,acceptable,,,,,,,,pending
NESTLE_2024_ceo_review_58_0,NESTLE,Nestle Nigeria Plc,Consumer Goods,2024,earnings_release,ceo_review,"Directors' Report-Continued (d) Human Rights in Our Business Activities (e) Leadership and Personal Responsibility (f) Safety and Health at Work (g) Supplier and Customer Relations (h) Agriculture and rural development (i) Environmental sustainability (j) Water

We fully support the United Nations Global Compact's (UNGC) guiding principles on human rights and labour and aim to provide an example of good human rights and labour practices throughout our business activities.",68,poor,,,,,,,,pending
NESTLE_2024_ceo_review_59_0,NESTLE,Nestle Nigeria Plc,Consumer Goods,2024,earnings_release,ceo_review,"We fully support the United Nations Global Compact's (UNGC) guiding principles on human rights and labour and aim to provide an example of good human rights and labour practices throughout our business activities.

Our success is based on our people. We treat each other with respect and dignity and expect everyone to promote a sense of personal responsibility. We recruit competent and motivated people who respect our values. We provide equal opportunities for our employees' development and advancement. We protect our employees' privacy and do not tolerate any form of harassment or discrimination.",93,acceptable,,,,,,,,pending
NESTLE_2024_ceo_review_66_0,NESTLE,Nestle Nigeria Plc,Consumer Goods,2024,earnings_release,ceo_review,"We are committed to preventing accidents, injuries and illness related to work, and to protect employees, contractors and others involved along the value chain. We recognise and require that everyone plays an active role in providing a safe and healthy environment, and promote awareness and knowledge of safety and health to employees, contractors and other people related to or impacted by our business activities by setting high standards.

We have Clinics in our Factories, Distribution Centre and Head Office. The Clinics at the factories operate 24 hours service. Also we have Hospitals listed on retainer basis with the company for our employees and their family use.",106,poor,,,,,,,,pending
NESTLE_2023_ceo_review_1_0,NESTLE,Nestle Nigeria Plc,Consumer Goods,2023,earnings_release,ceo_review,"The principal activities of the Company continue to be the manufacturing, marketing and distribution of food products including purified water throughout the country. The Company also exports some of its products to other countries within and outside Africa.

The directors who served during the period and their interests in the shares of the Company at the period ended 30",59,poor,,,,,,,,pending
NESTLE_2023_ceo_review_3_0,NESTLE,Nestle Nigeria Plc,Consumer Goods,2023,earnings_release,ceo_review,"No share options were granted to the directors by Nestlé Nigeria Plc. However, Nestlé S. A., the ultimate parent company has a share based payment scheme offered to certain key management personnel including certain directors of the Company.

*Out of the 2,328 shares of Nestlé Nigeria Plc held by Mr. Ibukun-olu Ipinmoye, 2,250 shares are managed on his behalf by FBN Quest Trustees Limited,while the remaining 78 shares are registered in his name.",73,poor,,,,,,,,pending
NESTLE_2023_ceo_review_4_0,NESTLE,Nestle Nigeria Plc,Consumer Goods,2023,earnings_release,ceo_review,"*Out of the 2,328 shares of Nestlé Nigeria Plc held by Mr. Ibukun-olu Ipinmoye, 2,250 shares are managed on his behalf by FBN Quest Trustees Limited,while the remaining 78 shares are registered in his name.

Mr. Gbenga Oyebode is the Chairman of CFAO Nigeria Plc, one of our vehicle suppliers. Mrs. Adebisi Lamikanra is a director of Standard Chartered Bank,one of our bankers. In accordance with Section 303 of the Companies and",72,poor,,,,,,,,pending
NESTLE_2023_ceo_review_5_0,NESTLE,Nestle Nigeria Plc,Consumer Goods,2023,earnings_release,ceo_review,"Mr. Gbenga Oyebode is the Chairman of CFAO Nigeria Plc, one of our vehicle suppliers. Mrs. Adebisi Lamikanra is a director of Standard Chartered Bank,one of our bankers. In accordance with Section 303 of the Companies and

Allied Matters Act of Nigeria, they have notified the Company of their position with CFAO Nigeria Plc and Standard",56,poor,,,,,,,,pending
NESTLE_2023_ceo_review_9_0,NESTLE,Nestle Nigeria Plc,Consumer Goods,2023,earnings_release,ceo_review,"On a continuing basis, the Company explores the use of local raw materials such as soya bean, maize, cocoa, palm olein and sorghum,cassava and corn starch in its production processes in a number of its products.

Apart from Societe Des Produits Nestlé S.A, Switzerland with 524,559,457 ordinary shares (representing 66.18%), no other shareholder held 5% or more of the paid-up capital of the Company as at 30 September 2023.",69,poor,,,,,,,,pending
NESTLE_2023_ceo_review_10_0,NESTLE,Nestle Nigeria Plc,Consumer Goods,2023,earnings_release,ceo_review,"Apart from Societe Des Produits Nestlé S.A, Switzerland with 524,559,457 ordinary shares (representing 66.18%), no other shareholder held 5% or more of the paid-up capital of the Company as at 30 September 2023.

We hereby confirm that the free float of the Company is in compliance with The  's free float requirements of the Main Board on which Nestlé Nigeria Plc is listed.",63,poor,,,,,,,,pending
NESTLE_2023_ceo_review_11_0,NESTLE,Nestle Nigeria Plc,Consumer Goods,2023,earnings_release,ceo_review,"We hereby confirm that the free float of the Company is in compliance with The  's free float requirements of the Main Board on which Nestlé Nigeria Plc is listed.

Information relating to changes in property, plant and equipment is disclosed in Note 9 to the financial statements.",48,poor,,,,,,,,pending
NESTLE_2023_ceo_review_14_0,NESTLE,Nestle Nigeria Plc,Consumer Goods,2023,earnings_release,ceo_review,"In addition to the above mentioned donations, the Company continued with its strong focus on creating shared values initiatives. Nestlé Nigeria invested in technical and employability skills building for youth and in building the capacity of farmers to increase their productivity and income. The Company also worked alongside partners to improve the household nutrition of local farmers through trainings in grain quality improvement and food transformation/preservation techniques.

Nestlé Nigeria Trust (CPFA) Limited ('NNTL') previously called Nestlé Nigeria Provident Fund Limited, was incorporated by the Company and is a duly registered Closed Pension Fund Administrator whose sole activity is the administration of the pension and defined contribution gratuity scheme for employees of Nestlé Nigeria Plc.",114,acceptable,,,,,,,,pending
NESTLE_2023_ceo_review_15_0,NESTLE,Nestle Nigeria Plc,Consumer Goods,2023,earnings_release,ceo_review,"Nestlé Nigeria Trust (CPFA) Limited ('NNTL') previously called Nestlé Nigeria Provident Fund Limited, was incorporated by the Company and is a duly registered Closed Pension Fund Administrator whose sole activity is the administration of the pension and defined contribution gratuity scheme for employees of Nestlé Nigeria Plc.

In compliance with Section 43(2) of the Companies and Allied Matters Act of Nigeria, the Company did not make any donation or gift to any political party, political association or for any political purpose during the period.",84,poor,,,,,,,,pending
NESTLE_2023_ceo_review_16_0,NESTLE,Nestle Nigeria Plc,Consumer Goods,2023,earnings_release,ceo_review,"In compliance with Section 43(2) of the Companies and Allied Matters Act of Nigeria, the Company did not make any donation or gift to any political party, political association or for any political purpose during the period.

The Company has a general licence agreement with Societe des Produits Nestlé S.A., Switzerland. Under the agreement, technological, scientific and professional assistance are provided for the manufacture, marketing, quality control and packaging of the Company's products, development of new products and training of personnel abroad. Access is also provided to the use of patents, brands, inventions and know-how.",95,poor,,,,,,,,pending
NESTLE_2023_ceo_review_17_0,NESTLE,Nestle Nigeria Plc,Consumer Goods,2023,earnings_release,ceo_review,"The Company has a general licence agreement with Societe des Produits Nestlé S.A., Switzerland. Under the agreement, technological, scientific and professional assistance are provided for the manufacture, marketing, quality control and packaging of the Company's products, development of new products and training of personnel abroad. Access is also provided to the use of patents, brands, inventions and know-how.

The Company obtained the approval of the National Office for Technology Acquisition and Promotion (NOTAP) with certificate No. CR 007459 for the remittance of General Licence Fees to Societe des Produits Nestlé S.A.,",91,poor,,,,,,,,pending
NESTLE_2023_ceo_review_18_0,NESTLE,Nestle Nigeria Plc,Consumer Goods,2023,earnings_release,ceo_review,"The Company obtained the approval of the National Office for Technology Acquisition and Promotion (NOTAP) with certificate No. CR 007459 for the remittance of General Licence Fees to Societe des Produits Nestlé S.A.,

Switzerland. The approval is for a period of three (3) years with effect from 1st January 2021 to 31st December",53,poor,,,,,,,,pending
NESTLE_2023_ceo_review_20_0,NESTLE,Nestle Nigeria Plc,Consumer Goods,2023,earnings_release,ceo_review,"The Company invests its resources to ensure that hygiene on its premises is of the highest standard. In this regard, the Company has, on three occasions, won the Manufacturers' Association of Nigeria's award for the best kept factory and on three occasions won the Federal Environmental Protection Agency's environmental performance award as the most environment-friendly company in Nigeria.

The Company places considerable value on the involvement of its employees and has continued the practice of keeping them informed on matters affecting them as employees and on various factors affecting the performance of the Company. Employee representatives are consulted regularly on a wide range of matters affecting their current and future interests.",111,good,,,,,,,,pending
NESTLE_2023_ceo_review_21_0,NESTLE,Nestle Nigeria Plc,Consumer Goods,2023,earnings_release,ceo_review,"The Company places considerable value on the involvement of its employees and has continued the practice of keeping them informed on matters affecting them as employees and on various factors affecting the performance of the Company. Employee representatives are consulted regularly on a wide range of matters affecting their current and future interests.

The Nestlé Technical Training Center (TTC) is a multi-skill engineering training program which runs for a period of",71,poor,,,,,,,,pending
NESTLE_2023_ceo_review_25_0,NESTLE,Nestle Nigeria Plc,Consumer Goods,2023,earnings_release,ceo_review,"Management, professional and technical expertise are the Company's major assets. The Company continues to invest in developing such skills. The Company has in-house training facilities, complemented, when and where necessary, with external and overseas training for its employees. This has broadened opportunities for career development within the organisation.

The Company operates its own clinics which provide quick health care to its employees. In pursuit of efforts to improve health infrastructure and enhance the quality of care for the employees, the company has built an ultra modern clinic at Agbara factory. The clinic which is fully equipped with state-of-the-art medical facilities consists of three consulting rooms, one pharmacy, one laboratory and two observation rooms, amongst others.",115,poor,,,,,,,,pending
NESTLE_2023_ceo_review_26_0,NESTLE,Nestle Nigeria Plc,Consumer Goods,2023,earnings_release,ceo_review,"The Company operates its own clinics which provide quick health care to its employees. In pursuit of efforts to improve health infrastructure and enhance the quality of care for the employees, the company has built an ultra modern clinic at Agbara factory. The clinic which is fully equipped with state-of-the-art medical facilities consists of three consulting rooms, one pharmacy, one laboratory and two observation rooms, amongst others.

The modernization of the medical facilities by the Company is in line with Nestlé Corporate Business principles of promoting safe and healthy work environment for the employee.",94,poor,,,,,,,,pending
NESTLE_2023_ceo_review_29_0,NESTLE,Nestle Nigeria Plc,Consumer Goods,2023,earnings_release,ceo_review,"It is the policy of the Company that there is no discrimination in considering applications for employment including those of physically challenged persons. The Company had 13 (Dec. 2022: 12) physically challenged persons in its employment as at 30 September 2023.

All employees whether physically challenged or not are given equal opportunities to develop their expertise and knowledge and qualify for promotion in furtherance of their careers. In the event of members of staff becoming physically challenged, every effort is made to ensure that their employment with the Company continues and that appropriate training is arranged. It is the policy of the Company that training, career development and promotion of physically challenged persons should, as far as possible, be identical with that of other employees.",125,poor,,,,,,,,pending
NESTLE_2023_ceo_review_30_0,NESTLE,Nestle Nigeria Plc,Consumer Goods,2023,earnings_release,ceo_review,"All employees whether physically challenged or not are given equal opportunities to develop their expertise and knowledge and qualify for promotion in furtherance of their careers. In the event of members of staff becoming physically challenged, every effort is made to ensure that their employment with the Company continues and that appropriate training is arranged. It is the policy of the Company that training, career development and promotion of physically challenged persons should, as far as possible, be identical with that of other employees.",84,poor,,,,,,,,pending
NESTLE_2023_ceo_review_31_0,NESTLE,Nestle Nigeria Plc,Consumer Goods,2023,earnings_release,ceo_review,"The Company caters for the recreational needs of its employees by providing them with a wellness center and other games facilities such as Table Tennis, Draughts, etc. Lunch is provided free to staff in the Company's canteen.

The total number of those who have so far completed the programme in our Technical Trainee Centers in Agbara and Abaji factories from 2013 to 30th September 2023 is one hundred and thirty-nine (139). The cost of the training for the eight (8) sets of graduates was fully paid by our Company.",89,poor,,,,,,,,pending
NESTLE_2023_ceo_review_32_0,NESTLE,Nestle Nigeria Plc,Consumer Goods,2023,earnings_release,ceo_review,"The total number of those who have so far completed the programme in our Technical Trainee Centers in Agbara and Abaji factories from 2013 to 30th September 2023 is one hundred and thirty-nine (139). The cost of the training for the eight (8) sets of graduates was fully paid by our Company.

To empower the trainees with relevant skills, the top five (5) students in the scheme were taken to Switzerland for further training within the Group's factories. We are pleased to inform you that the sets of TTC graduates that completed their 18 months program in 2021 recorded outstanding results despite the impact of COVID-19.",106,poor,,,,,,,,pending
NESTLE_2023_ceo_review_33_0,NESTLE,Nestle Nigeria Plc,Consumer Goods,2023,earnings_release,ceo_review,"To empower the trainees with relevant skills, the top five (5) students in the scheme were taken to Switzerland for further training within the Group's factories. We are pleased to inform you that the sets of TTC graduates that completed their 18 months program in 2021 recorded outstanding results despite the impact of COVID-19.

In accordance with section 404 of the Companies and Allied Matters Act of Nigeria 2020, members of the audit committee of the Company were elected at the Annual General Meeting held on 17 May 2023. Members that served on the audit committee during the period comprise:",100,poor,,,,,,,,pending
NESTLE_2023_ceo_review_34_0,NESTLE,Nestle Nigeria Plc,Consumer Goods,2023,earnings_release,ceo_review,"In accordance with section 404 of the Companies and Allied Matters Act of Nigeria 2020, members of the audit committee of the Company were elected at the Annual General Meeting held on 17 May 2023. Members that served on the audit committee during the period comprise:

The success of the TTC in our Agbara and Abaji factories has encouraged us to establish the TTC model in our",67,poor,,,,,,,,pending
NESTLE_2023_ceo_review_37_0,NESTLE,Nestle Nigeria Plc,Consumer Goods,2023,earnings_release,ceo_review,"The Nomination, Governance and Remuneration Committee is made up of three (3) directors appointed to make recommendations on the structure and composition of the Board and its Committees; governance issues and to submit proposals on the salaries of executive directors to the Board for approval. The members of the Committee are Mr.Mauricio Alarcon, Mr. Ricardo Chavez (up to 31 January 2023), Mr. Martin Kruegel (from 1 February 2023),

The best graduating trainee had 33 distinctions from City and Guilds examinations from levels 3 to 5. The latest batch of graduates of the scheme in Agbara factory (20 Trainees) completed their 18 months program in August",105,poor,,,,,,,,pending
NESTLE_2023_ceo_review_38_0,NESTLE,Nestle Nigeria Plc,Consumer Goods,2023,earnings_release,ceo_review,"The best graduating trainee had 33 distinctions from City and Guilds examinations from levels 3 to 5. The latest batch of graduates of the scheme in Agbara factory (20 Trainees) completed their 18 months program in August

2022 and recorded outstanding result. The best graduating trainee had 29 distinctions from City and Guild examinations from levels 3 to 5.",59,poor,,,,,,,,pending
NESTLE_2023_ceo_review_45_0,NESTLE,Nestle Nigeria Plc,Consumer Goods,2023,earnings_release,ceo_review,"We encourage Health and Wellness of our employees via Work-Life Balance, provision of gym and other recreational facilities on our premises, provision of baby room, extended maternity leave that is not annual leave consuming and paternity leave.

Everywhere in the world, the Nestlé name guarantees to the consumer that the product is safe and of high standard.",57,poor,,,,,,,,pending
NESTLE_2023_ceo_review_48_0,NESTLE,Nestle Nigeria Plc,Consumer Goods,2023,earnings_release,ceo_review,"The Committee is to assist the Board in its oversight of audit, risk profile, risk management framework and the risk reward strategy. The Committee is to carry out periodic review of changes in the economic and business environment, including emerging trends and other factors relevant to the Company's risk profile. The members of the Committee are Mr. Oyebode (up to 17 May 2023), Dr. Juliet Ehimuan, Mrs. Adebisi Lamikanra and Mrs.

The Company has a structured Risk Management process in place and undertakes at least annually a thorough",88,good,,,,,,,,pending
NESTLE_2023_ceo_review_52_0,NESTLE,Nestle Nigeria Plc,Consumer Goods,2023,earnings_release,ceo_review,"The Company pays adequate attention to the interest of its stakeholders such as its employees, host community, the consumers and the general public. Also, the Company is sensitive to Nigerian's social and cultural diversity and promotes as much as possible national interests as well as national ethos and values without compromising global aspirations where applicable. The Company has a culture of integrity and zero tolerance to corruption and corrupt practices.

The Company has contractual relationship with related companies in the ordinary course of business. In addition, the Company (and other operating companies of Nestlé in Central and West Africa) executed a Shared Services",103,poor,,,,,,,,pending
