passage_id,ticker,company,sector,year,doc_type,section,text,word_count,quality,sentiment_label,sentiment_intensity,has_guidance,guidance_type,guidance_span,annotator,annotation_notes,annotation_status
DANGCEM_Unknown_ceo_review_11_0,DANGCEM,DANGCEM,Industrial,Unknown,manual_pdf,ceo_review,"The significant accounting policies applied in the preparation of these Unaudited Financial Statements are set out below. These policies have been consistently applied to all the years presented, unless otherwise stated.

The Unaudited Financial Statements have been prepared in accordance with, and comply with, International Financial Reporting Standards (IFRS) Accounting Standards, International Financial Reporting Interpretations Committee (IFRIC), interpretations issued by the International",62,poor,,,,,,,,pending
DANGCEM_Unknown_ceo_review_12_0,DANGCEM,DANGCEM,Industrial,Unknown,manual_pdf,ceo_review,"The Unaudited Financial Statements have been prepared in accordance with, and comply with, International Financial Reporting Standards (IFRS) Accounting Standards, International Financial Reporting Interpretations Committee (IFRIC), interpretations issued by the International

Accounting Standards Board (IASB), Companies and Allied Matters Act (CAMA) and Financial Reporting Council of Nigeria (Amendment) Act,",49,poor,,,,,,,,pending
DANGCEM_Unknown_ceo_review_17_0,DANGCEM,DANGCEM,Industrial,Unknown,manual_pdf,ceo_review,"Items included in the financial statements of the Company are measured using the currency of the primary economic environment in which the entity operates ('the functional currency'). The functional currency and presentation currency of the Company is the Nigerian NGN (N) has been rounded to the nearest thousand ((NGN thousands)), unless otherwise stated.

A foreign currency transaction is recorded, on initial recognition in NGN, by applying to the foreign currency amount the spot exchange rate between the functional currency and the foreign currency at the date of the transaction.",89,poor,,,,,,,,pending
DANGCEM_Unknown_ceo_review_18_0,DANGCEM,DANGCEM,Industrial,Unknown,manual_pdf,ceo_review,"A foreign currency transaction is recorded, on initial recognition in NGN, by applying to the foreign currency amount the spot exchange rate between the functional currency and the foreign currency at the date of the transaction.

 non-monetary items that are measured in terms of historical cost in a foreign currency are translated using the exchange rate at the date of the transaction; and  non-monetary items that are measured at fair value in a foreign currency are translated using the exchange rates at the date when the fair value was determined.",92,poor,,,,,,,,pending
DANGCEM_Unknown_ceo_review_19_0,DANGCEM,DANGCEM,Industrial,Unknown,manual_pdf,ceo_review," non-monetary items that are measured in terms of historical cost in a foreign currency are translated using the exchange rate at the date of the transaction; and  non-monetary items that are measured at fair value in a foreign currency are translated using the exchange rates at the date when the fair value was determined.

Exchange differences arising on the settlement of monetary items or on translating monetary items at rates different from those at which they were translated on initial recognition during the period or in previous unaudited financial statements are recognised in profit or loss as other operating gains/(losses) in the period in which they arise.",109,poor,,,,,,,,pending
DANGCEM_Unknown_ceo_review_21_0,DANGCEM,DANGCEM,Industrial,Unknown,manual_pdf,ceo_review,"When a gain or loss on a non-monetary item is recognised in other comprehensive income and accumulated in equity, any exchange component of that gain or loss is recognised in other comprehensive income and accumulated in equity. When a gain or loss on a nonmonetary item is recognised in profit or loss, any foreign exchange component of that gain or loss is recognised in profit or loss as other operating gains/(losses).

Cash flows arising from transactions in a foreign currency are recorded in NGN by applying to the foreign currency amount the exchange rate between the NGN and the foreign currency at the date of the cash flow.",108,acceptable,,,,,,,,pending
DANGCEM_Unknown_ceo_review_22_0,DANGCEM,DANGCEM,Industrial,Unknown,manual_pdf,ceo_review,"Cash flows arising from transactions in a foreign currency are recorded in NGN by applying to the foreign currency amount the exchange rate between the NGN and the foreign currency at the date of the cash flow.

Revenue is measured at the fair value of the consideration received or receivable for goods or services, in the ordinary course of the",60,poor,,,,,,,,pending
DANGCEM_Unknown_ceo_review_26_0,DANGCEM,DANGCEM,Industrial,Unknown,manual_pdf,ceo_review,"Revenue is recognised when the control of the goods and service are transferred to the customer. This occurs when the goods are delivered to the customer and customer's acceptance is received or when goods are picked up by the customers. Revenue is driven by the regional spread of the Company's customer network.

Nascon Allied Industries Plc transfers control to the customers after the goods have been delivered to the customer, however, the customer obtains the right to return goods that are bad or damaged after they have been delivered.",89,acceptable,,,,,,,,pending
DANGCEM_Unknown_ceo_review_27_0,DANGCEM,DANGCEM,Industrial,Unknown,manual_pdf,ceo_review,"Nascon Allied Industries Plc transfers control to the customers after the goods have been delivered to the customer, however, the customer obtains the right to return goods that are bad or damaged after they have been delivered.

Sale occurs when the goods have been delivered to the specific location, the risks of obsolescence and loss have been transferred to the customer, and when the customer has accepted the products in accordance with the sales contract, or the acceptance provisions have lapsed, or the Company has objective evidence that all criteria for acceptance have been satisfied.",95,poor,,,,,,,,pending
DANGCEM_Unknown_ceo_review_28_0,DANGCEM,DANGCEM,Industrial,Unknown,manual_pdf,ceo_review,"Sale occurs when the goods have been delivered to the specific location, the risks of obsolescence and loss have been transferred to the customer, and when the customer has accepted the products in accordance with the sales contract, or the acceptance provisions have lapsed, or the Company has objective evidence that all criteria for acceptance have been satisfied.

Revenue from sale of goods is recognised based on the price specified in the contract, net of the estimated rebates and returns. Rebates are estimated at the inception of the contract except where the period between the recognition of revenue and grant of rebates is within one month.",106,good,,,,,,,,pending
DANGCEM_Unknown_ceo_review_33_0,DANGCEM,DANGCEM,Industrial,Unknown,manual_pdf,ceo_review,"Interest income is calculated by applying the effective interest rate to the gross carrying amount of financial assets. The effective interest rate is the rate that exactly discounts estimated future cash receipts through the expected life of the financial asset to its gross carrying amount.

Short term employee benefits: any wages, salaries, incentives, other contributions and paid annual leave are accrued in the period in which the associated services are rendered by employees of the Company.",76,acceptable,,,,,,,,pending
DANGCEM_Unknown_ceo_review_35_0,DANGCEM,DANGCEM,Industrial,Unknown,manual_pdf,ceo_review,"Termination benefits are payable when employment is terminated before the normal retirement date, or whenever an employee accepts voluntary redundancy in exchange for these benefits. The Company recognises termination benefits when it is demonstrably committed to either terminating the employment of current employees according to a detailed formal plan without possibility of withdrawal; or as a result of an offer made to encourage voluntary redundancy. The expected cost of compensation is recognized as an expense in the profit or loss account when it occurs.",84,good,,,,,,,,pending
DANGCEM_Unknown_ceo_review_36_0,DANGCEM,DANGCEM,Industrial,Unknown,manual_pdf,ceo_review,"A defined benefit plan is a post-employment benefit plan other than a defined contribution plan. The Company's net obligation in respect of defined benefit gratuity scheme is calculated by estimating the amount of future benefits that employees have earned in return for their service in the current and prior years and that benefit is discounted to determine the present value.

The employees of the Company are members of a Defined Contribution Pension plan administered by third-party Pension Fund",78,poor,,,,,,,,pending
DANGCEM_Unknown_ceo_review_38_0,DANGCEM,DANGCEM,Industrial,Unknown,manual_pdf,ceo_review,"Administrators under the Pension Reform Act of 2014. The assets of the plan are held separately from those of the Company. The scheme is funded in accordance with the Pension Reform Act of 2014 with the employee and employer contributions representing 8% and 10% respectively of the employee's relevant emoluments.

The tax currently payable is based on taxable profit for the year. Taxable profit differs from profit as reported in the statements of profit or loss and other comprehensive income because of items of income or expense that are taxable or deductible in other years and items that are never taxable or deductible. The Company's liability for current tax is calculated using tax rates that have been enacted or substantively enacted by the end of the reporting period.",128,good,,,,,,,,pending
DANGCEM_Unknown_ceo_review_39_0,DANGCEM,DANGCEM,Industrial,Unknown,manual_pdf,ceo_review,"The tax currently payable is based on taxable profit for the year. Taxable profit differs from profit as reported in the statements of profit or loss and other comprehensive income because of items of income or expense that are taxable or deductible in other years and items that are never taxable or deductible. The Company's liability for current tax is calculated using tax rates that have been enacted or substantively enacted by the end of the reporting period.

Current income tax is the expected amount of income tax payable on the taxable profit for the year determined in accordance with the",101,good,,,,,,,,pending
DANGCEM_Unknown_ceo_review_41_0,DANGCEM,DANGCEM,Industrial,Unknown,manual_pdf,ceo_review,"Companies Income Tax Act (CITA) using statutory tax rates at the reporting date. Tertiary Education tax is assessed at 3% of the assessable profits as defined by the Tertiary Education Tax Act and  Police Trust Fund levy is charged at 0.005% of profit before tax section 4 of the

Deferred tax assets and liabilities are measured at the tax rates that are expected to apply in the period in which the liability is settled or the asset realised, based on tax rates (and tax laws) that have been enacted or substantively enacted by the end of the reporting period.",99,good,,,,,,,,pending
DANGCEM_Unknown_ceo_review_42_0,DANGCEM,DANGCEM,Industrial,Unknown,manual_pdf,ceo_review,"Deferred tax assets and liabilities are measured at the tax rates that are expected to apply in the period in which the liability is settled or the asset realised, based on tax rates (and tax laws) that have been enacted or substantively enacted by the end of the reporting period.

The measurement of deferred tax liabilities and assets reflects the tax consequences that would follow from the manner in which the",71,poor,,,,,,,,pending
DANGCEM_Unknown_ceo_review_45_0,DANGCEM,DANGCEM,Industrial,Unknown,manual_pdf,ceo_review,"Deferred tax assets and liabilities are offset when there is a legally enforceable right to set off current tax assets against current tax liabilities and when they relate to income taxes levied by the same taxation authority and the Company intends to settle its current tax assets and liabilities on a net basis.

Deferred tax assets are recognised only to the extent that it is probable that future taxable profit will be available against which the temporary differences can be utilised.",81,poor,,,,,,,,pending
DANGCEM_Unknown_ceo_review_49_0,DANGCEM,DANGCEM,Industrial,Unknown,manual_pdf,ceo_review,"Cost includes expenditure that is directly attributable to the acquisition of the asset. Assets under construction are disclosed as capital workin-progress. The cost of construction recognised includes the cost of materials and direct labour, any other costs directly attributable to bringing the assets to a working condition for their intended use, the costs of dismantling and removing the items and restoring the site on which they are located, and borrowing costs on qualifying assets.

Purchased software that is integral to the functionality of the related equipment is capitalized as part of the equipment.",93,acceptable,,,,,,,,pending
DANGCEM_Unknown_ceo_review_52_0,DANGCEM,DANGCEM,Industrial,Unknown,manual_pdf,ceo_review,"Gains and losses on disposal of an item of property, plant and equipment are determined by comparing the proceeds from disposal with the carrying amount of property, plant and equipment, and are recognized in the statement of profit or loss and other comprehensive income.

The cost of replacing a part of an item of property, plant and equipment is recognised in the carrying amount of the item if it is probable that the future economic benefits embodied within the part will flow to the Company and its cost can be measured reliably. The carrying amount of the replaced part is derecognized. The costs of the day-to-day servicing of property, plant and equipment are recognised in profit or loss as incurred.",120,good,,,,,,,,pending
DANGCEM_Unknown_ceo_review_53_0,DANGCEM,DANGCEM,Industrial,Unknown,manual_pdf,ceo_review,"The cost of replacing a part of an item of property, plant and equipment is recognised in the carrying amount of the item if it is probable that the future economic benefits embodied within the part will flow to the Company and its cost can be measured reliably. The carrying amount of the replaced part is derecognized. The costs of the day-to-day servicing of property, plant and equipment are recognised in profit or loss as incurred.

Depreciation is calculated on the depreciable amount, which is the cost of an asset, or other amount substituted for cost, less its estimated residual value.",101,good,,,,,,,,pending
DANGCEM_Unknown_ceo_review_55_0,DANGCEM,DANGCEM,Industrial,Unknown,manual_pdf,ceo_review,"Depreciation is recognised in profit or loss on a straight-line basis over the estimated useful lives of each part of an item of property, plant and equipment which reflects the expected pattern of consumption of the future economic benefits embodied in the asset. Leased assets are depreciated over the shorter of the lease term and their useful lives unless it is reasonably certain that the Company will obtain ownership by the end of the lease term in which case the assets are depreciated over the useful life.",87,poor,,,,,,,,pending
DANGCEM_Unknown_ceo_review_57_0,DANGCEM,DANGCEM,Industrial,Unknown,manual_pdf,ceo_review,"Capital work-in-progress and freehold land are not depreciated. The attributable cost of each asset is transferred to the relevant asset category immediately the asset is available for use and depreciated accordingly.

Properties in the course of construction for production, supply or administrative purposes, or for purposes not yet determined, are carried at cost, less any recognised impairment loss. Cost includes professional fees capitalised and determined to be directly required to bring the asset to the location and condition for intended use and, for qualifying assets, borrowing costs capitalised in accordance with the Company's accounting policy. Depreciation of these assets, on the same basis as other property assets, commences when the assets are ready for their intended use.",117,good,,,,,,,,pending
DANGCEM_Unknown_ceo_review_58_0,DANGCEM,DANGCEM,Industrial,Unknown,manual_pdf,ceo_review,"Properties in the course of construction for production, supply or administrative purposes, or for purposes not yet determined, are carried at cost, less any recognised impairment loss. Cost includes professional fees capitalised and determined to be directly required to bring the asset to the location and condition for intended use and, for qualifying assets, borrowing costs capitalised in accordance with the Company's accounting policy. Depreciation of these assets, on the same basis as other property assets, commences when the assets are ready for their intended use.",86,good,,,,,,,,pending
DANGCEM_Unknown_ceo_review_59_0,DANGCEM,DANGCEM,Industrial,Unknown,manual_pdf,ceo_review,"Depreciation is recognised so as to write off the cost of assets (other than properties under construction) less their residual values over their useful lives, using the straight-line method. The estimated useful lives, residual values and depreciation method are reviewed at each year end, with the effect of any changes in estimate accounted for on a prospective basis.

An item of property, plant and equipment is derecognised upon disposal or when no future economic benefits are expected to arise from the continued use of the asset. Any gain or loss arising on the disposal or retirement of an item of property, plant and equipment is determined as the difference between the sales proceeds and the carrying amount of the asset and is recognised in statement of profit or loss as other operating gains/(losses).",133,good,,,,,,,,pending
DANGCEM_Unknown_ceo_review_60_0,DANGCEM,DANGCEM,Industrial,Unknown,manual_pdf,ceo_review,"An item of property, plant and equipment is derecognised upon disposal or when no future economic benefits are expected to arise from the continued use of the asset. Any gain or loss arising on the disposal or retirement of an item of property, plant and equipment is determined as the difference between the sales proceeds and the carrying amount of the asset and is recognised in statement of profit or loss as other operating gains/(losses).

At inception of a contract, the Company assesses whether a contract is, or contains, a lease. A contract is, or contains a lease if the contract conveys the right to control the use of an identified asset for a period of time in exchange for consideration. To assess whether a contract conveys the right to control the use of an identified asset, the Company assesses whether:",141,good,,,,,,,,pending
DANGCEM_Unknown_ceo_review_61_0,DANGCEM,DANGCEM,Industrial,Unknown,manual_pdf,ceo_review,"At inception of a contract, the Company assesses whether a contract is, or contains, a lease. A contract is, or contains a lease if the contract conveys the right to control the use of an identified asset for a period of time in exchange for consideration. To assess whether a contract conveys the right to control the use of an identified asset, the Company assesses whether:

- the contract involves the use of an identified asset. This may be specified explicitly or implicitly. If the supplier has a substantive substitution right, then the asset is not identified, - the Company has the right to obtain substantially all of the economic benefits from use of the asset throughout the period of use, and - the Company has the right to direct the use of the asset. The Company has this right when it has the decision-making rights that are most relevant to changing how and for what purpose the asset is used.",161,poor,,,,,,,,pending
DANGCEM_Unknown_ceo_review_62_0,DANGCEM,DANGCEM,Industrial,Unknown,manual_pdf,ceo_review,"- the contract involves the use of an identified asset. This may be specified explicitly or implicitly. If the supplier has a substantive substitution right, then the asset is not identified, - the Company has the right to obtain substantially all of the economic benefits from use of the asset throughout the period of use, and - the Company has the right to direct the use of the asset. The Company has this right when it has the decision-making rights that are most relevant to changing how and for what purpose the asset is used.",95,poor,,,,,,,,pending
DANGCEM_Unknown_ceo_review_63_0,DANGCEM,DANGCEM,Industrial,Unknown,manual_pdf,ceo_review,"In rare cases where the decision about how and for what purpose the asset is used is predetermined, the Company has the right to direct the use of the asset if either:

Leases (continued) - the Company designed the asset in a way that predetermines how and for what purpose it will be used.",54,poor,,,,,,,,pending
DANGCEM_Unknown_ceo_review_65_0,DANGCEM,DANGCEM,Industrial,Unknown,manual_pdf,ceo_review,"The Company's leases include land, buildings (residential apartments) and warehouses. The lease terms are typically for fixed periods ranging from 2- 20 years but may have extension options as described below. On renewal of a lease, the terms may be renegotiated.

Contracts may contain both lease and non-lease components. The Company has elected not to separate lease and non-lease components and instead account for these as a single lease component. Lease terms are negotiated on an individual basis and contain different terms and conditions, including extension and termination options. The lease agreements do not impose any covenants, however, leased assets may not be used as security for borrowing purposes.",109,poor,,,,,,,,pending
DANGCEM_Unknown_ceo_review_66_0,DANGCEM,DANGCEM,Industrial,Unknown,manual_pdf,ceo_review,"Contracts may contain both lease and non-lease components. The Company has elected not to separate lease and non-lease components and instead account for these as a single lease component. Lease terms are negotiated on an individual basis and contain different terms and conditions, including extension and termination options. The lease agreements do not impose any covenants, however, leased assets may not be used as security for borrowing purposes.

Leases are recognised as a right-of-use asset and a corresponding liability at the date at which the leased asset is available for use by the",93,poor,,,,,,,,pending
DANGCEM_Unknown_ceo_review_68_0,DANGCEM,DANGCEM,Industrial,Unknown,manual_pdf,ceo_review,"At the commencement date of a lease, the Company recognises lease liabilities measured at the present value of lease payments to be made over the lease term. Lease liabilities include the net present value of the following lease payments:

 fixed payments (including in-substance fixed payments), less any lease incentives receivable  variable lease payments that are based on an index or a rate,  amounts expected to be payable by the Company under residual value guarantees,  the exercise price of a purchase option if the lessee is reasonably certain to exercise that option,  payments of penalties for terminating the lease, if the lease term reflects the Company's exercising that option.",113,poor,,,,,,,,pending
DANGCEM_Unknown_ceo_review_69_0,DANGCEM,DANGCEM,Industrial,Unknown,manual_pdf,ceo_review," fixed payments (including in-substance fixed payments), less any lease incentives receivable  variable lease payments that are based on an index or a rate,  amounts expected to be payable by the Company under residual value guarantees,  the exercise price of a purchase option if the lessee is reasonably certain to exercise that option,  payments of penalties for terminating the lease, if the lease term reflects the Company's exercising that option.

Lease payments to be made under reasonably certain extension options are also included in the measurement of the liability. The variable lease payments that do not depend on an index or a rate are recognised as expenses in the period in which the event or condition that triggers the payment occurs.",125,acceptable,,,,,,,,pending
DANGCEM_Unknown_ceo_review_70_0,DANGCEM,DANGCEM,Industrial,Unknown,manual_pdf,ceo_review,"Lease payments to be made under reasonably certain extension options are also included in the measurement of the liability. The variable lease payments that do not depend on an index or a rate are recognised as expenses in the period in which the event or condition that triggers the payment occurs.

The lease payments are discounted using the Company's incremental borrowing rate (IBR) as the rate implicit in the lease cannot be readily determined. The IBR represents the rate that the Company would have to pay to borrow the funds necessary to obtain an asset of similar value to the right of use asset in a similar economic environment with similar terms, security and conditions.",115,poor,,,,,,,,pending
DANGCEM_Unknown_ceo_review_71_0,DANGCEM,DANGCEM,Industrial,Unknown,manual_pdf,ceo_review,"The lease payments are discounted using the Company's incremental borrowing rate (IBR) as the rate implicit in the lease cannot be readily determined. The IBR represents the rate that the Company would have to pay to borrow the funds necessary to obtain an asset of similar value to the right of use asset in a similar economic environment with similar terms, security and conditions.

To determine the incremental borrowing rate, the Company uses recent third-party financing received as a starting point, adjusted to reflect changes in financing conditions since third party financing was received or uses a build-up approach that starts with a risk-free interest rate adjusted for credit risk for its leases which does not have recent third-party financing, and makes adjustments specific to the lease, e.g. term, coun",130,acceptable,,,,,,,,pending
