passage_id,ticker,company,sector,year,doc_type,section,text,word_count,quality,sentiment_label,sentiment_intensity,has_guidance,guidance_type,guidance_span,annotator,annotation_notes,annotation_status
ACCESS_Unknown_chairman_statement_6_0,ACCESS,ACCESS,Banking,Unknown,manual_pdf,chairman_statement,"The Group acquired 74.85% of SCB Gambia and the Consumer, Private and Business Banking Segment of SCB Tanzania during the period under review. The Group also completed the divestment of 25% of its shareholdings plus one additional share  in Access Bank South Africa

Access Holdings was incorporated as a public limited liability company on 10 February 2021. The Company is a Nigerian Exchange premium board listed parent non-operating Financial Holding Company for Access Bank ('the Bank') and the related Group Entities that emerged from the  court-sanctioned Scheme of Arrangement between the  Bank and holders of its fully paid ordinary shares of 50 Kobo each.",104,poor,,,,,,,,pending
ACCESS_Unknown_chairman_statement_7_0,ACCESS,ACCESS,Banking,Unknown,manual_pdf,chairman_statement,"Access Holdings was incorporated as a public limited liability company on 10 February 2021. The Company is a Nigerian Exchange premium board listed parent non-operating Financial Holding Company for Access Bank ('the Bank') and the related Group Entities that emerged from the  court-sanctioned Scheme of Arrangement between the  Bank and holders of its fully paid ordinary shares of 50 Kobo each.

The Directors have the pleasure in presenting their report on the affairs of Access Holdings Plc (""the Company"") and its subsidiaries (together referred to as ""the Group"" and separately referred to as ""Group entities""), the Company and the Group's Consolidated and Separate Interim Financial Statements with Auditor's Report for the period ended 30 June 2025.",116,acceptable,,,,,,,,pending
ACCESS_Unknown_chairman_statement_8_0,ACCESS,ACCESS,Banking,Unknown,manual_pdf,chairman_statement,"The Directors have the pleasure in presenting their report on the affairs of Access Holdings Plc (""the Company"") and its subsidiaries (together referred to as ""the Group"" and separately referred to as ""Group entities""), the Company and the Group's Consolidated and Separate Interim Financial Statements with Auditor's Report for the period ended 30 June 2025.

On 16 July 2025, Access Bank UK issued Additional Tier 1 loan notes to the value of $295 million (N451.9 billion) to Access Holdings Plc.",80,acceptable,,,,,,,,pending
ACCESS_Unknown_chairman_statement_10_0,ACCESS,ACCESS,Banking,Unknown,manual_pdf,chairman_statement,"Executive Director *Appointed as Group Managing Director/ Chief Executive Officer on August 29, 2025 **Served as Acting Group Chief Executive Officer from March 1, 2024 to August 29, 2025 ***Appointed as a Independence Non-Executive Director effective April 15, 2025 ****Resigned as a Non-Executive Director effective August 7, 2025 *****Resigned as a Non-Executive Director effective March 11, 2025

*Appointed as a Independent Non-Executive Director effective April 15, 2025 **Resigned as a Non-Executive Director effective March 11, 2025 ***Resigned as a Non-Executive Director effective August 7, 2025",85,poor,,,,,,,,pending
ACCESS_Unknown_chairman_statement_12_0,ACCESS,ACCESS,Banking,Unknown,manual_pdf,chairman_statement,"The Directors who served during the period, together with their direct and indirect interests in the issued share capital of the Company as recorded in the Register of Directors' Shareholding and as notified by the Directors for the purposes of Sections 301 and 302 of the Companies and Allied Matters Act and listing requirements of the Nigerian Exchange Ltd are noted below:

The board of directors of Access Holdings Plc appointed Innocent Ike as Group Managing Director/Chief Executive Officer effective August 29, 2025 upon Central Bank of Nigeria approval.",89,poor,,,,,,,,pending
ACCESS_Unknown_chairman_statement_15_0,ACCESS,ACCESS,Banking,Unknown,manual_pdf,chairman_statement,"In accordance with the provisions of  Section 303 (1) and (3) of the  Companies  and Allied Matters Act 2020, the following Directors have disclosed their interest in the under listed vendors to the company.

Insurance **Resigned as a Non-Executive Director effective March 11, 2025 ***Resigned as a Non-Executive Director effective August 7, 2025",53,poor,,,,,,,,pending
ACCESS_Unknown_chairman_statement_17_0,ACCESS,ACCESS,Banking,Unknown,manual_pdf,chairman_statement,"7.41% *Stanbic Nominees held the shares as custodian for various investors. Stanbic Nominees does not exercise any right over the underlying shares. All the rights resides with the various investors on behalf of whom Stanbic Nominees carries out the custodian services.

The company identifies with the aspirations of the community and the environment in which it operates. This balance is included in events, charities and sponsorship in the operating expense in Note 15.",73,poor,,,,,,,,pending
ACCESS_Unknown_chairman_statement_18_0,ACCESS,ACCESS,Banking,Unknown,manual_pdf,chairman_statement,"The company identifies with the aspirations of the community and the environment in which it operates. This balance is included in events, charities and sponsorship in the operating expense in Note 15.

The group made contributions to charitable and non-charitable organisations amounting to N351 million (June 2024:N1,480millionn) during the period, as listed below:",53,poor,,,,,,,,pending
ACCESS_Unknown_chairman_statement_20_0,ACCESS,ACCESS,Banking,Unknown,manual_pdf,chairman_statement,"Information relating to changes in property and equipment is given in Note 28 to the consolidated and separate financial statements. In the Directors' opinion, the fair value of the Group's property and equipment is not less than the carrying value in the financial statements.

Employment of physically challenged (iii) Health, safety and welfare of employees (iv) Employee involvement and training (v",61,poor,,,,,,,,pending
ACCESS_Unknown_chairman_statement_0_0,ACCESS,ACCESS,Banking,Unknown,manual_pdf,chairman_statement,"Executive Director *Approved by Central Bank of Nigeria ('CBN') as an Independent Non-Executive Director on April 15, 2025 **Resigned from the Board on August 7, 2025 ***Resigned from the Board on March 11, 2025 ****Approved by CBN as Group Managing Director/Chief Executive Officer on August 22, 2025 *****Served as Acting Group Chief Executive Officer from March 1, 2024 to August 28, 2025

This is the list of directors who served in the company during the year and up to the date of this report",84,poor,,,,,,,,pending
ACCESS_Unknown_chairman_statement_3_0,ACCESS,ACCESS,Banking,Unknown,manual_pdf,chairman_statement,"The Company's business segments comprise deposit money banking, wealth and investment management, financial technology and insurance while its operating and direct subsidiaries are Access Bank Plc, Hydrogen Payment Services Company Limited, Oxygen X Finance Company Limited and Access Insurance Brokers Limited.

Access Golf Limited is a Special Purpose Vehicle for  the Company's equity investment in its indirect subsidiary, Access ARM Pension Limited.",62,poor,,,,,,,,pending
ACCESS_Unknown_chairman_statement_9_0,ACCESS,ACCESS,Banking,Unknown,manual_pdf,chairman_statement,"In line with Section 7.1 of the CBN Guidelines for Licensing and Regulation of Financial Holding Companies in Nigeria (2014), which defines minimum paid-up capital as the aggregate of the par value of issued shares and any related share premium, the Group obtained approval for a NGN21.42 billion private placement from the Central Bank of Nigeria on 20 February 2026.

This capital raise brings the Group into full compliance with the minimum paid-up capital requirement under the CBN Guidelines.",79,poor,,,,,,,,pending
ACCESS_Unknown_chairman_statement_11_0,ACCESS,ACCESS,Banking,Unknown,manual_pdf,chairman_statement,"There were no significant events after the reporting date that could affect the reported amount of assets and liabilities as of the reporting date which have not been adjusted for, or disclosed in the financial statements.

The Directors who served during the year, together with their direct and indirect interests in the issued share capital of the Company as recorded in the Register of",64,poor,,,,,,,,pending
ACCESS_Unknown_chairman_statement_14_0,ACCESS,ACCESS,Banking,Unknown,manual_pdf,chairman_statement,"The directors have the pleasure in presenting their report on the affairs of Access Holdings Plc (""the Company"") and its subsidiaries (together referred to as ""the Group"" and separately referred to as ""Group entities""), the Company and the Group's Consolidated and Separate Financial Statements with Auditor's Report for the year ended 31

Access Holdings Plc was incorporated as a public limited liability company on 10 February 2021. The Company is a Nigerian Exchange premium board listed parent nonoperating Financial Holding Company for Access Bank ('the Bank') and the related Group entities that emerged from the court-sanctioned Scheme of Arrangement between the  Bank and holders of its fully paid ordinary shares of 50 Kobo each.",114,poor,,,,,,,,pending
ACCESS_Unknown_chairman_statement_19_0,ACCESS,ACCESS,Banking,Unknown,manual_pdf,chairman_statement,"The company identifies with the aspirations of the community and the environment in which it operates. This balance is included in events, charities and sponsorship in the operating expense in Note 15. The group made contributions to charitable and non-charitable organisations amounting to N2,855 million (December 2024:

Sponsorship for the 1st Artificial Intelligence and Blockchain International Conference (AIBIC) Abuja 2025",60,poor,,,,,,,,pending
ACCESS_Unknown_ceo_review_10_0,ACCESS,ACCESS,Banking,Unknown,manual_pdf,ceo_review,"Access Holdings Plc (""the company"") is domiciled in Nigeria. The address of the company's registered office is No 14/15, Prince Alaba Oniru Road, Oniru, Lagos (formerly Plot 999c, Danmole Street, off

Adeola Odeku/Idejo Street, Victoria Island, Lagos). The consolidated and separate financial statements of the Company for the year ended 31 December 2025 comprises the Holding Company and its subsidiaries (together referred to as ""the Group"" and separately referred to as ""Group entities""). The",74,acceptable,,,,,,,,pending
ACCESS_Unknown_ceo_review_11_0,ACCESS,ACCESS,Banking,Unknown,manual_pdf,ceo_review,"Adeola Odeku/Idejo Street, Victoria Island, Lagos). The consolidated and separate financial statements of the Company for the year ended 31 December 2025 comprises the Holding Company and its subsidiaries (together referred to as ""the Group"" and separately referred to as ""Group entities""). The

Company's business segments include banking, consumer lending, payment services, insurance brokerage and pension funds administration. The Company is listed on  .",64,acceptable,,,,,,,,pending
ACCESS_Unknown_ceo_review_17_0,ACCESS,ACCESS,Banking,Unknown,manual_pdf,ceo_review,"The financial statements have been prepared in accordance with the going concern principle under the historical cost convention, modified to include fair valuation of particular financial instruments, non current assets held for sale and investment properties to the extent required or permitted under IFRS as set out in the relevant accounting policies. ,as management is satisfied that the Group has adequate resources to continue as a going concern for the foreseeable future. In making this assessment, management has considered a wide range of information including projections of profitability, regulatory capital requirements and funding needs.",94,good,,,,,,,,pending
ACCESS_Unknown_ceo_review_18_0,ACCESS,ACCESS,Banking,Unknown,manual_pdf,ceo_review,"Interpretations Committee (IFRIC) applicable to companies reporting under IFRS. This consolidated and separate financial statement comprise the consolidated and separate statement of comprehensive income, the consolidated and separate statement of financial position, the consolidated and separate statements of changes in equity, the consolidated and separate cash flow statement and the accompanying notes.

share based payment at fair value or an approximation of fair value allowed by the relevant standard.",69,poor,,,,,,,,pending
ACCESS_Unknown_ceo_review_22_0,ACCESS,ACCESS,Banking,Unknown,manual_pdf,ceo_review,"Items included in the financial statements of each of the Group's entities are measured using the currency of the primary economic environment in which the entity operates ('the functional currency').

Plc's functional and presentation currency; except where indicated, financial information presented in",42,poor,,,,,,,,pending
ACCESS_Unknown_ceo_review_25_0,ACCESS,ACCESS,Banking,Unknown,manual_pdf,ceo_review,"IAS 21 specifies how an entity should assess whether a currency is exchangeable and how it should determine a spot exchange rate when exchangeability is lacking. A currency is considered to be exchangeable into another currency when an entity is able to obtain the other currency within a time frame that allows for a normal administrative delay and through a market or exchange mechanism in which an exchange transaction would create enforceable rights and obligations.

The material principal accounting policies adopted in the preparation of these financial statements are set out below. These policies have been consistently applied to all periods presented, unless otherwise stated.",105,poor,,,,,,,,pending
ACCESS_Unknown_ceo_review_26_0,ACCESS,ACCESS,Banking,Unknown,manual_pdf,ceo_review,"The material principal accounting policies adopted in the preparation of these financial statements are set out below. These policies have been consistently applied to all periods presented, unless otherwise stated.",30,poor,,,,,,,,pending
ACCESS_Unknown_chairman_statement_4_0,ACCESS,ACCESS,Banking,Unknown,manual_pdf,chairman_statement,"That we are responsible for establishing and maintaining internal controls and have designed such internal controls to ensure that material information relating to the Group is made known to the officer by other officers of the companies, during the period ended 31 March 2026..

The directors have the pleasure in presenting their report on the affairs of Access Holdings Plc (""the",61,poor,,,,,,,,pending
AIICO_Unknown_chairman_statement_0_0,AIICO,AIICO,Banking,Unknown,manual_pdf,chairman_statement,"05 March 2026 (B) AIICO Insurance Plc with a free float value of N38,581,133,653.18 as at 31 December 2025, is compliant with The  's free float requirements for companies listed on the Main Board.

(A) AIICO Insurance Plc with a free float percentage of 27.81% as at 31 December 2025, is compliant with The  's free float requirements for companies listed on the Main Board.",65,acceptable,,,,,,,,pending
AIICO_Unknown_chairman_statement_1_0,AIICO,AIICO,Banking,Unknown,manual_pdf,chairman_statement,"(A) AIICO Insurance Plc with a free float percentage of 27.81% as at 31 December 2025, is compliant with The  's free float requirements for companies listed on the Main Board.

The Company is registered with the National Insurance Commission (""NAICOM""). It has two subsidiaries namely:",46,poor,,,,,,,,pending
AIICO_Unknown_chairman_statement_3_0,AIICO,AIICO,Banking,Unknown,manual_pdf,chairman_statement,"The Board of Directors, pursuant to the powers vested in it by the provisions of Sections 426 of the Companies and Allied Matters Act (CAMA) of Nigeria 2020, recommended a dividend of 12 kobo per share (2024: 7 kobo per share) for the financial period ended 31 December 2025.

The Directors present their annual report on the affairs of AIICO Insurance Plc (""the Company"") and the subsidiary companies (""the Group""), together with the audited consolidated and separate financial statements and the Auditor's Report for the year ended 31 December 2025.",90,poor,,,,,,,,pending
AIICO_Unknown_chairman_statement_4_0,AIICO,AIICO,Banking,Unknown,manual_pdf,chairman_statement,"The Directors present their annual report on the affairs of AIICO Insurance Plc (""the Company"") and the subsidiary companies (""the Group""), together with the audited consolidated and separate financial statements and the Auditor's Report for the year ended 31 December 2025.

The Company was established in 1963 by the American Life Insurance Company and was incorporated as a limited liability company on 14 July 1970. It was converted to a Public Liability Company in 1989 and quoted on the Nigerian Exchange (NGX) Group with effect from December 3, 1990. The Company was registered by the Federal Government of Nigeria to provide Insurance services in Life Insurance Business, Non-Life Insurance Business, Deposit Administration and",113,acceptable,,,,,,,,pending
AIICO_Unknown_chairman_statement_5_0,AIICO,AIICO,Banking,Unknown,manual_pdf,chairman_statement,"The Company was established in 1963 by the American Life Insurance Company and was incorporated as a limited liability company on 14 July 1970. It was converted to a Public Liability Company in 1989 and quoted on the Nigerian Exchange (NGX) Group with effect from December 3, 1990. The Company was registered by the Federal Government of Nigeria to provide Insurance services in Life Insurance Business, Non-Life Insurance Business, Deposit Administration and

AIICO Multishield Limited was incorporated in 1997 as a Health Management Organization. It commenced operations in the same year with prepaid health plans to cater for the health needs of individuals and corporate organizations. The Company became a full subsidiary of AIICO Insurance Plc on July 1, 2012.",120,acceptable,,,,,,,,pending
AIICO_Unknown_chairman_statement_6_0,AIICO,AIICO,Banking,Unknown,manual_pdf,chairman_statement,"AIICO Multishield Limited was incorporated in 1997 as a Health Management Organization. It commenced operations in the same year with prepaid health plans to cater for the health needs of individuals and corporate organizations. The Company became a full subsidiary of AIICO Insurance Plc on July 1, 2012.

AIICO Capital Limited was registered and licensed by the Securities & Exchange Commission in 2012, to carry out portfolio/fund management services. AIICO",70,acceptable,,,,,,,,pending
AIICO_Unknown_chairman_statement_8_0,AIICO,AIICO,Banking,Unknown,manual_pdf,chairman_statement,"Capital Limited commenced full operations in 2014 through the provision of bespoke wealth solutions for clients, by adopting a research based approach for every investment decision. AIICO Capital Limited offers portfolio management services, structured investments and mutual funds to suit the investment needs of corporate and individual clients. AIICO Capital invested in its subsidiary, AIICO Capital Credit and Finance Limited, which is 100% owned by AIICO Capital Limited and commenced operations in September 2024. In 2025, the AIICO Capital Limited (Group) implemented a restructuring after it had obtained regulatory approval from the  (SEC) to offer investment banking services. As at 31 December 2025, the AIICO Capital Group comprises the following and the subsidiaries are fully owned by AIICO Capital Limited.",120,acceptable,,,,,,,,pending
AIICO_Unknown_chairman_statement_9_0,AIICO,AIICO,Banking,Unknown,manual_pdf,chairman_statement,"- AIICO Capital Limited (parent) -  Issuing House (licensed by SEC) - AIICO Capital Credit and Finance Limited (subsidiary) -  Financing House (licensed by LASG - Money lending license) - AIICO Capital Investment Managers Limited (subsidiary) -  Portfolio managers (licensed by SEC)

At the Company's AGM held on 27 May 2025, the Shareholders declared a dividend of 7 kobo per share (2024: 5 kobo, Bonus Nil) on the year ended 31",71,poor,,,,,,,,pending
AIICO_Unknown_ceo_review_3_0,AIICO,AIICO,Banking,Unknown,manual_pdf,ceo_review,"Insurance Industry Reform Act, 2025 and relevant National Insurance Commission (NAICOM) guidelines and circulars, the Investment Securities Act 2025 and in compliance with the Financial Reporting Council of Nigeria (Amendment) Act, 2023.

The Directors further accept responsibility for maintaining adequate accounting records as required by the Companies and Allied Matters Act, 2020 and for such internal control as the directors determine is necessary to enable the preparation of the consolidated and separate financial statements that are free from material misstatement whether due to fraud or error.",86,poor,,,,,,,,pending
AIICO_Unknown_ceo_review_4_0,AIICO,AIICO,Banking,Unknown,manual_pdf,ceo_review,"The Directors further accept responsibility for maintaining adequate accounting records as required by the Companies and Allied Matters Act, 2020 and for such internal control as the directors determine is necessary to enable the preparation of the consolidated and separate financial statements that are free from material misstatement whether due to fraud or error.

The Directors have made an assessment of the ability of AIICO Insurance Plc (""the Company"") and the subsidiary companies (""the Group"") to continue as a going concern and have no reason to believe that the Group and Company will not remain a going concern in the year ahead.",102,poor,,,,,,,,pending
AIICO_Unknown_ceo_review_5_0,AIICO,AIICO,Banking,Unknown,manual_pdf,ceo_review,"The Directors have made an assessment of the ability of AIICO Insurance Plc (""the Company"") and the subsidiary companies (""the Group"") to continue as a going concern and have no reason to believe that the Group and Company will not remain a going concern in the year ahead.

Appropriate and adequate internal controls are established to safeguard the assets of the Group and to prevent and detect fraud and other irregularities;",71,poor,,,,,,,,pending
AIICO_Unknown_ceo_review_7_0,AIICO,AIICO,Banking,Unknown,manual_pdf,ceo_review,"The Group keeps proper accounting records which disclose with reasonable accuracy the financial position and which ensure that the financial statements comply with the requirements of the IFRS Accounting Standards as issued by International Accounting Standards Board, Companies and Allied Matters

Act, 2020, Nigerian Insurance Industry Reform Act, 2025 and relevant National Insurance Commission (NAICOM) guidelines and circulars, Investment",59,poor,,,,,,,,pending
AIICO_Unknown_ceo_review_12_0,AIICO,AIICO,Banking,Unknown,manual_pdf,ceo_review,"The Directors further accept responsibility for the maintenance of accounting records that may be relied upon in the preparation of the consolidated and separate financial statements, as well as adequate systems of financial control.

The Directors have made an assessment on the Company's ability to continue as a going concern and have no reason to believe that the Company will not remain a going concern in the year ahead.",69,poor,,,,,,,,pending
AIICO_Unknown_ceo_review_13_0,AIICO,AIICO,Banking,Unknown,manual_pdf,ceo_review,"The Directors have made an assessment on the Company's ability to continue as a going concern and have no reason to believe that the Company will not remain a going concern in the year ahead.

The Directors accept responsibility for the year's consolidated and separate financial statements, which have been prepared using appropriate accounting policies supported by reasonable and prudent judgements and estimates in conformity with:",66,poor,,,,,,,,pending
AIICO_Unknown_ceo_review_14_0,AIICO,AIICO,Banking,Unknown,manual_pdf,ceo_review,"The Directors accept responsibility for the year's consolidated and separate financial statements, which have been prepared using appropriate accounting policies supported by reasonable and prudent judgements and estimates in conformity with:

We have identified in the report whether or not there were significant changes in internal controls or other factors that could significantly affect internal controls subsequent to the date of our evaluation, including any corrective actions with regard to significant deficiencies and material weaknesses.",75,poor,,,,,,,,pending
AIICO_Unknown_ceo_review_15_0,AIICO,AIICO,Banking,Unknown,manual_pdf,ceo_review,"We have identified in the report whether or not there were significant changes in internal controls or other factors that could significantly affect internal controls subsequent to the date of our evaluation, including any corrective actions with regard to significant deficiencies and material weaknesses.

We the undersigned, hereby certify the following with regards to our audited financial statements for the year ended 31 December 2025 that:",66,poor,,,,,,,,pending
AIICO_Unknown_ceo_review_18_0,AIICO,AIICO,Banking,Unknown,manual_pdf,ceo_review,"To the best of our knowledge, the financial statements and other financial information included in the report fairly present in all material respects the financial condition and results of operation of the Group as of, and for the periods presented in the report.

have designed such internal controls to ensure that material information relating to the Company and its consolidated subsidiaries is made known to such officers by others within those entities particularly during the periods in which these reports are being prepared;",83,poor,,,,,,,,pending
AIICO_Unknown_ceo_review_19_0,AIICO,AIICO,Banking,Unknown,manual_pdf,ceo_review,"have designed such internal controls to ensure that material information relating to the Company and its consolidated subsidiaries is made known to such officers by others within those entities particularly during the periods in which these reports are being prepared;

have presented in the report our conclusions about the effectiveness of our internal controls based on our evaluation as of that date;",62,poor,,,,,,,,pending
